{
  "node": "Document",
  "cortexVersion": "0.1",
  "encoding": "UTF-8",
  "glossary": {
    "node": "Glossary",
    "format": {
      "node": "FormatDeclaration",
      "cortex": "0.1",
      "encoding": "UTF-8",
      "attributes": [
        {
          "node": "AttrPair",
          "key": "cortex",
          "value": {
            "node": "DecimalValue",
            "value": "0.1",
            "lexeme": "0.1"
          }
        },
        {
          "node": "AttrPair",
          "key": "encoding",
          "value": {
            "node": "AtomValue",
            "value": "UTF-8",
            "lexeme": "UTF-8"
          }
        },
        {
          "node": "AttrPair",
          "key": "language",
          "value": {
            "node": "AtomValue",
            "value": "es",
            "lexeme": "es"
          }
        }
      ],
      "sourceLine": 2
    },
    "meta": [
      {
        "node": "MetaDeclaration",
        "name": "format",
        "attributes": [
          {
            "node": "AttrPair",
            "key": "cortex",
            "value": {
              "node": "DecimalValue",
              "value": "0.1",
              "lexeme": "0.1"
            }
          },
          {
            "node": "AttrPair",
            "key": "encoding",
            "value": {
              "node": "AtomValue",
              "value": "UTF-8",
              "lexeme": "UTF-8"
            }
          },
          {
            "node": "AttrPair",
            "key": "language",
            "value": {
              "node": "AtomValue",
              "value": "es",
              "lexeme": "es"
            }
          }
        ],
        "sourceLine": 2
      }
    ],
    "enums": [],
    "micros": [],
    "namespaces": [],
    "extensions": [],
    "symbols": [
      {
        "node": "SymbolDefinition",
        "surface": "REL",
        "namespace": null,
        "qualified": "REL",
        "label": "relation",
        "shape": "relacion",
        "weight": "M",
        "focus": "predicate",
        "description": "Relación dirigida explícita",
        "open": false,
        "contract": [
          {
            "name": "source",
            "type": "atom",
            "required": true
          },
          {
            "name": "predicate",
            "type": "atom",
            "required": true
          },
          {
            "name": "target",
            "type": "atom",
            "required": true
          },
          {
            "name": "evidence",
            "type": "text",
            "required": false
          }
        ],
        "attributes": [
          {
            "node": "AttrPair",
            "key": "type",
            "value": {
              "node": "AtomValue",
              "value": "relacion",
              "lexeme": "relacion"
            }
          },
          {
            "node": "AttrPair",
            "key": "weight",
            "value": {
              "node": "AtomValue",
              "value": "M",
              "lexeme": "M"
            }
          },
          {
            "node": "AttrPair",
            "key": "pos",
            "value": {
              "node": "StringValue",
              "value": "source:atom|predicate:atom|target:atom|evidence:text?",
              "lexeme": "\"source:atom|predicate:atom|target:atom|evidence:text?\""
            }
          },
          {
            "node": "AttrPair",
            "key": "focus",
            "value": {
              "node": "AtomValue",
              "value": "predicate",
              "lexeme": "predicate"
            }
          },
          {
            "node": "AttrPair",
            "key": "desc",
            "value": {
              "node": "StringValue",
              "value": "Relación dirigida explícita",
              "lexeme": "\"Relación dirigida explícita\""
            }
          }
        ],
        "sourceLine": 3
      }
    ]
  },
  "sections": [
    {
      "node": "Section",
      "id": 1,
      "title": null,
      "ideas": [
        {
          "node": "Idea",
          "address": "$1:REL:parser_ast",
          "section": 1,
          "symbol": "REL",
          "qualifiedSymbol": "REL",
          "name": "parser_ast",
          "function": {
            "label": "relation",
            "weight": "M",
            "focus": "predicate"
          },
          "shape": "relacion",
          "payload": {
            "node": "RelationPayload",
            "cells": [
              {
                "node": "StringValue",
                "value": "parser",
                "lexeme": "parser"
              },
              {
                "node": "StringValue",
                "value": "produces",
                "lexeme": "produces"
              },
              {
                "node": "StringValue",
                "value": "AST",
                "lexeme": "AST"
              },
              {
                "node": "StringValue",
                "value": "contrato del codec",
                "lexeme": "contrato del codec"
              }
            ],
            "bound": [
              {
                "field": "source",
                "value": {
                  "node": "StringValue",
                  "value": "parser",
                  "lexeme": "parser"
                }
              },
              {
                "field": "predicate",
                "value": {
                  "node": "StringValue",
                  "value": "produces",
                  "lexeme": "produces"
                }
              },
              {
                "field": "target",
                "value": {
                  "node": "StringValue",
                  "value": "AST",
                  "lexeme": "AST"
                }
              },
              {
                "field": "evidence",
                "value": {
                  "node": "StringValue",
                  "value": "contrato del codec",
                  "lexeme": "contrato del codec"
                }
              }
            ]
          },
          "sourceLine": 5
        }
      ]
    }
  ]
}
