{
  "node": "Document",
  "cortexVersion": "0.1",
  "encoding": "UTF-8",
  "glossary": {
    "node": "Glossary",
    "format": {
      "node": "FormatDeclaration",
      "cortex": "0.1",
      "encoding": "UTF-8",
      "attributes": [
        {
          "node": "AttrPair",
          "key": "cortex",
          "value": {
            "node": "DecimalValue",
            "value": "0.1",
            "lexeme": "0.1"
          }
        },
        {
          "node": "AttrPair",
          "key": "encoding",
          "value": {
            "node": "AtomValue",
            "value": "UTF-8",
            "lexeme": "UTF-8"
          }
        },
        {
          "node": "AttrPair",
          "key": "language",
          "value": {
            "node": "AtomValue",
            "value": "es",
            "lexeme": "es"
          }
        }
      ],
      "sourceLine": 2
    },
    "meta": [
      {
        "node": "MetaDeclaration",
        "name": "format",
        "attributes": [
          {
            "node": "AttrPair",
            "key": "cortex",
            "value": {
              "node": "DecimalValue",
              "value": "0.1",
              "lexeme": "0.1"
            }
          },
          {
            "node": "AttrPair",
            "key": "encoding",
            "value": {
              "node": "AtomValue",
              "value": "UTF-8",
              "lexeme": "UTF-8"
            }
          },
          {
            "node": "AttrPair",
            "key": "language",
            "value": {
              "node": "AtomValue",
              "value": "es",
              "lexeme": "es"
            }
          }
        ],
        "sourceLine": 2
      }
    ],
    "enums": [],
    "micros": [],
    "namespaces": [],
    "extensions": [],
    "symbols": [
      {
        "node": "SymbolDefinition",
        "surface": "KNW",
        "namespace": "",
        "qualified": "KNW",
        "label": "knowledge",
        "shape": "attrs",
        "weight": "B",
        "focus": "content",
        "description": "Conocimiento verificable",
        "open": false,
        "contract": [
          {
            "name": "topic",
            "type": "text",
            "required": true
          },
          {
            "name": "content",
            "type": "text",
            "required": true
          }
        ],
        "attributes": [
          {
            "node": "AttrPair",
            "key": "type",
            "value": {
              "node": "AtomValue",
              "value": "attrs",
              "lexeme": "attrs"
            }
          },
          {
            "node": "AttrPair",
            "key": "weight",
            "value": {
              "node": "AtomValue",
              "value": "B",
              "lexeme": "B"
            }
          },
          {
            "node": "AttrPair",
            "key": "fields",
            "value": {
              "node": "StringValue",
              "value": "topic:text|content:text",
              "lexeme": "\"topic:text|content:text\""
            }
          },
          {
            "node": "AttrPair",
            "key": "focus",
            "value": {
              "node": "AtomValue",
              "value": "content",
              "lexeme": "content"
            }
          },
          {
            "node": "AttrPair",
            "key": "desc",
            "value": {
              "node": "StringValue",
              "value": "Conocimiento verificable",
              "lexeme": "\"Conocimiento verificable\""
            }
          }
        ],
        "sourceLine": 3
      }
    ]
  },
  "sections": [
    {
      "node": "Section",
      "id": 1,
      "title": "",
      "ideas": [
        {
          "node": "Idea",
          "address": "$1:KNW:codec",
          "section": 1,
          "symbol": "KNW",
          "qualifiedSymbol": "KNW",
          "name": "codec",
          "function": {
            "label": "knowledge",
            "weight": "B",
            "focus": "content"
          },
          "shape": "attrs",
          "payload": {
            "node": "AttrsPayload",
            "pairs": [
              {
                "node": "AttrPair",
                "key": "topic",
                "value": {
                  "node": "StringValue",
                  "value": "CORTEX",
                  "lexeme": "\"CORTEX\""
                }
              },
              {
                "node": "AttrPair",
                "key": "content",
                "value": {
                  "node": "StringValue",
                  "value": "Codec ideático lineal.",
                  "lexeme": "\"Codec ideático lineal.\""
                }
              }
            ]
          },
          "sourceLine": 4
        }
      ]
    }
  ]
}
