{
  "node": "Document",
  "cortexVersion": "0.1",
  "encoding": "UTF-8",
  "glossary": {
    "node": "Glossary",
    "format": {"node":"FormatDeclaration","cortex":"0.1","encoding":"UTF-8","attributes":[{"node":"AttrPair","key":"cortex","value":{"node":"DecimalValue","value":"0.1","lexeme":"0.1"}},{"node":"AttrPair","key":"encoding","value":{"node":"AtomValue","value":"UTF-8","lexeme":"UTF-8"}},{"node":"AttrPair","key":"language","value":{"node":"AtomValue","value":"es","lexeme":"es"}}],"sourceLine":2},
    "meta": [{"node":"MetaDeclaration","name":"format","attributes":[{"node":"AttrPair","key":"cortex","value":{"node":"DecimalValue","value":"0.1","lexeme":"0.1"}},{"node":"AttrPair","key":"encoding","value":{"node":"AtomValue","value":"UTF-8","lexeme":"UTF-8"}},{"node":"AttrPair","key":"language","value":{"node":"AtomValue","value":"es","lexeme":"es"}}],"sourceLine":2}],
    "enums": [{"node":"EnumDeclaration","name":"state","values":["current","planned","done"],"sourceLine":3}],
    "micros": [],
    "namespaces": [],
    "extensions": [],
    "symbols": [{"node":"SymbolDefinition","surface":"KNW","namespace":null,"qualified":"KNW","label":"knowledge","shape":"attrs","weight":"B","focus":"content","description":"Conocimiento verificable","open":false,"contract":[{"name":"topic","type":"text","required":true},{"name":"content","type":"text","required":true},{"name":"status","type":"%state","required":true},{"name":"evidence","type":"text","required":false}],"attributes":[{"node":"AttrPair","key":"type","value":{"node":"AtomValue","value":"attrs","lexeme":"attrs"}},{"node":"AttrPair","key":"weight","value":{"node":"AtomValue","value":"B","lexeme":"B"}},{"node":"AttrPair","key":"fields","value":{"node":"StringValue","value":"topic:text|content:text|status:%state|evidence:text?","lexeme":"\"topic:text|content:text|status:%state|evidence:text?\""}},{"node":"AttrPair","key":"focus","value":{"node":"AtomValue","value":"content","lexeme":"content"}},{"node":"AttrPair","key":"desc","value":{"node":"StringValue","value":"Conocimiento verificable","lexeme":"\"Conocimiento verificable\""}}],"sourceLine":4}]
  },
  "sections": [{"node":"Section","id":1,"title":null,"ideas":[{"node":"Idea","address":"$1:KNW:determinism","section":1,"symbol":"KNW","qualifiedSymbol":"KNW","name":"determinism","function":{"label":"knowledge","weight":"B","focus":"content"},"shape":"attrs","payload":{"node":"AttrsPayload","pairs":[{"node":"AttrPair","key":"topic","value":{"node":"StringValue","value":"Determinismo","lexeme":"\"Determinismo\""}},{"node":"AttrPair","key":"content","value":{"node":"StringValue","value":"Misma entrada produce igual estructura.","lexeme":"\"Misma entrada produce igual estructura.\""}},{"node":"AttrPair","key":"status","value":{"node":"AtomValue","value":"current","lexeme":"current"}},{"node":"AttrPair","key":"evidence","value":{"node":"StringValue","value":"corpus V003","lexeme":"\"corpus V003\""}}]},"sourceLine":6}]}]
}
