{
  "node": "Document",
  "cortexVersion": "0.1",
  "encoding": "UTF-8",
  "glossary": {
    "node": "Glossary",
    "format": {
      "node": "FormatDeclaration",
      "cortex": "0.1",
      "encoding": "UTF-8",
      "attributes": [
        {
          "node": "AttrPair",
          "key": "cortex",
          "value": {
            "node": "DecimalValue",
            "value": "0.1",
            "lexeme": "0.1"
          }
        },
        {
          "node": "AttrPair",
          "key": "encoding",
          "value": {
            "node": "AtomValue",
            "value": "UTF-8",
            "lexeme": "UTF-8"
          }
        },
        {
          "node": "AttrPair",
          "key": "language",
          "value": {
            "node": "AtomValue",
            "value": "es",
            "lexeme": "es"
          }
        }
      ],
      "sourceLine": 2
    },
    "meta": [
      {
        "node": "MetaDeclaration",
        "name": "format",
        "attributes": [
          {
            "node": "AttrPair",
            "key": "cortex",
            "value": {
              "node": "DecimalValue",
              "value": "0.1",
              "lexeme": "0.1"
            }
          },
          {
            "node": "AttrPair",
            "key": "encoding",
            "value": {
              "node": "AtomValue",
              "value": "UTF-8",
              "lexeme": "UTF-8"
            }
          },
          {
            "node": "AttrPair",
            "key": "language",
            "value": {
              "node": "AtomValue",
              "value": "es",
              "lexeme": "es"
            }
          }
        ],
        "sourceLine": 2
      }
    ],
    "enums": [],
    "micros": [],
    "namespaces": [],
    "extensions": [],
    "symbols": [
      {
        "node": "SymbolDefinition",
        "surface": "HDL",
        "namespace": "",
        "qualified": "HDL",
        "label": "handler",
        "shape": "attrs-pos",
        "weight": "M",
        "focus": "operation",
        "description": "Operación determinista",
        "open": false,
        "contract": [
          {
            "name": "operation",
            "type": "text",
            "required": true
          },
          {
            "name": "status",
            "type": "text",
            "required": true
          },
          {
            "name": "requires",
            "type": "text",
            "required": true
          },
          {
            "name": "notes",
            "type": "text",
            "required": false
          }
        ],
        "attributes": [
          {
            "node": "AttrPair",
            "key": "type",
            "value": {
              "node": "AtomValue",
              "value": "attrs-pos",
              "lexeme": "attrs-pos"
            }
          },
          {
            "node": "AttrPair",
            "key": "weight",
            "value": {
              "node": "AtomValue",
              "value": "M",
              "lexeme": "M"
            }
          },
          {
            "node": "AttrPair",
            "key": "pos",
            "value": {
              "node": "StringValue",
              "value": "operation:text|status:text|requires:text|notes:text?",
              "lexeme": "\"operation:text|status:text|requires:text|notes:text?\""
            }
          },
          {
            "node": "AttrPair",
            "key": "focus",
            "value": {
              "node": "AtomValue",
              "value": "operation",
              "lexeme": "operation"
            }
          },
          {
            "node": "AttrPair",
            "key": "desc",
            "value": {
              "node": "StringValue",
              "value": "Operación determinista",
              "lexeme": "\"Operación determinista\""
            }
          }
        ],
        "sourceLine": 3
      }
    ]
  },
  "sections": [
    {
      "node": "Section",
      "id": 1,
      "title": "",
      "ideas": [
        {
          "node": "Idea",
          "address": "$1:HDL:render",
          "section": 1,
          "symbol": "HDL",
          "qualifiedSymbol": "HDL",
          "name": "render",
          "function": {
            "label": "handler",
            "weight": "M",
            "focus": "operation"
          },
          "shape": "attrs-pos",
          "payload": {
            "node": "PositionalPayload",
            "cells": [
              {
                "node": "AtomValue",
                "value": "convertir",
                "lexeme": "convertir"
              },
              {
                "node": "AtomValue",
                "value": "current",
                "lexeme": "current"
              },
              {
                "node": "AtomValue",
                "value": "entrada",
                "lexeme": "entrada"
              },
              {
                "node": "AtomValue",
                "value": "preservar",
                "lexeme": "preservar"
              }
            ],
            "bound": [
              {
                "field": "operation",
                "value": {
                  "node": "AtomValue",
                  "value": "convertir",
                  "lexeme": "convertir"
                }
              },
              {
                "field": "status",
                "value": {
                  "node": "AtomValue",
                  "value": "current",
                  "lexeme": "current"
                }
              },
              {
                "field": "requires",
                "value": {
                  "node": "AtomValue",
                  "value": "entrada",
                  "lexeme": "entrada"
                }
              },
              {
                "field": "notes",
                "value": {
                  "node": "AtomValue",
                  "value": "preservar",
                  "lexeme": "preservar"
                }
              }
            ]
          },
          "sourceLine": 4
        }
      ]
    }
  ]
}
